{
  "error_message": null,
  "execution_status": "COMPLETED",
  "experiment_id": "kdc-smoke20-all-registered-final-20261012T074200",
  "run_id": "run_20261012T042032Z__local-search__minmax__kroE100-02a50775c87e-d8d2268527__r00__a9755cd00dd2",
  "run_key": "a9165391f0a7e73261f5446633cb8c0b071e6e61c3aa0a47d2e02d03ac45af57",
  "schema_version": 1,
  "solver_result": {
    "actual_backend": "local-search",
    "actual_threads": 1,
    "algorithm_category": "heuristic",
    "algorithm_name": "local-search",
    "bound_status": "CERTIFIED",
    "build_type": "Release",
    "candidate_count": 925,
    "certified_gap": null,
    "certified_lower_bound": 1678.5229769650714,
    "compiler": "Apple LLVM 17.0.0 (clang-1700.6.3.2)",
    "configuration": {
      "algorithm": "local-search",
      "cache_policy": "auto",
      "global_time_limit_sec": 5.0,
      "handovers_enabled": true,
      "minmaxsum_minmax_budget_fraction": 0.5,
      "minmaxsum_minsum_budget_fraction": 0.5,
      "minsum_refinement_policy": "CERTIFIED_BOUND",
      "objective": "minmax",
      "per_static_time_limit_sec": 2.0,
      "profile": "DEBUG",
      "repeat": 0,
      "seed": 2714735465,
      "verify_after": true,
      "verify_each_iteration": true
    },
    "coverage_nnz": null,
    "cpu_time_sec": 0.40482,
    "dataset_profile": "smoke20",
    "dominance_invariants_ok": false,
    "dominates_minmax": false,
    "dominates_minsum": false,
    "empirical_ratio_to_exact": null,
    "error_message": "",
    "exact_solver": false,
    "experiment_id": "kdc-smoke20-all-registered-final-20261012T074200",
    "experiment_label": "smoke / development validation",
    "external_timeout": false,
    "failed": false,
    "failed_native_solve_count": 0,
    "fallback_solve_count": 0,
    "fallback_used": false,
    "feasible": true,
    "gap": 2.108500477994018,
    "git_commit": "f28b4e3866a51575ea47dddb3362694d84c6de25",
    "global_time_limit_sec": 5.0,
    "handovers_enabled": true,
    "heuristic_gap": 5217.689476219866,
    "heuristic_lower_bound": 0.0,
    "initial_peak_cost": 7925.107683787894,
    "instance_id": "kroE100-02a50775c87e-d8d2268527",
    "instance_name": "kroE100",
    "integral_cost": 3855.3049236747243,
    "joint": null,
    "kont_version": "not-applicable",
    "lower_bound": 1678.5229769650714,
    "m": 25,
    "minmax_component_certified_gap": null,
    "minmax_component_integral": null,
    "minmax_component_peak": null,
    "minmax_source_run": "",
    "minmaxsum_minmax_optimality": "FAILED",
    "minmaxsum_minmax_status": "NOT_RUN",
    "minmaxsum_minsum_optimality": "FAILED",
    "minmaxsum_minsum_status": "NOT_RUN",
    "minsum_component_certified_gap": null,
    "minsum_component_integral": null,
    "minsum_component_peak": null,
    "minsum_refinement_policy": "HEURISTIC_ADAPTIVE",
    "minsum_source_run": "",
    "n": 37,
    "native_kont": false,
    "native_solve_count": 0,
    "num_ip_solves": 6,
    "num_iterations": 5,
    "num_static_solves": 6,
    "objective": "minmax",
    "objective_value": 5217.689476219866,
    "objective_vector": null,
    "optimality_status": "FEASIBLE",
    "peak_consistent": true,
    "peak_cost": 5217.689476219866,
    "peak_memory_mb": 17.890625,
    "peak_time": 0.0,
    "per_static_time_limit_sec": 2.0,
    "ratio_to_incumbent": 1.0,
    "refinement_policy": "HEURISTIC_ADAPTIVE",
    "repeat": 0,
    "requested_backend": "branch-and-bound",
    "result_json_path": "result/result.json",
    "run_id": "run_20261012T042032Z__local-search__minmax__kroE100-02a50775c87e-d8d2268527__r00__a9755cd00dd2",
    "run_key": "a9165391f0a7e73261f5446633cb8c0b071e6e61c3aa0a47d2e02d03ac45af57",
    "schema_version": 3,
    "seed": 42,
    "selected_backend": "branch-and-bound",
    "serialization_time_sec": 0.000854167,
    "solution_json_path": "result/solution.json",
    "solve_time_sec": 0.22929345799999998,
    "solver_name": "local-search",
    "solver_runtime_sec": 0.22929345799999998,
    "thread_count": 1,
    "time_limit_per_ip_sec": 2.0,
    "time_limited": false,
    "timeout": false,
    "total_wall_time_sec": 0.407280625,
    "trace_csv_path": "result/trace.csv",
    "trace_jsonl_path": "result/trace.jsonl",
    "upper_bound": 5217.689476219866,
    "verification_kind": "certified_continuous",
    "verification_time_sec": 0.17708825000000003,
    "verified": true,
    "verify_after": true,
    "verify_each_iteration": true,
    "wall_time_sec": 0.407280625,
    "wrapper_wall_time_sec": 0.42331900000000644
  }
}
