{
  "error_message": null,
  "execution_status": "FAILED",
  "experiment_id": "kdc-smoke20-all-registered-final-20261012T074200",
  "run_id": "run_20261012T042122Z__brute-force__minsum__rd100-9407ab41999f-b9917bc5f5__r00__4ad80437a993",
  "run_key": "876e46acfbf4501429dc4c309352fa8b95c1235333d79d0008c638f0ce29ee7a",
  "schema_version": 1,
  "solver_result": {
    "actual_backend": "brute-force",
    "actual_threads": 1,
    "algorithm_category": "diagnostic",
    "algorithm_name": "brute-force",
    "bound_status": "NONE",
    "build_type": "Release",
    "candidate_count": 925,
    "certified_gap": null,
    "certified_lower_bound": 0.0,
    "compiler": "Apple LLVM 17.0.0 (clang-1700.6.3.2)",
    "configuration": {
      "algorithm": "brute-force",
      "cache_policy": "auto",
      "diagnostic_category": "validation_diagnostic",
      "global_time_limit_sec": 0.5,
      "handovers_enabled": true,
      "max_assignments": 100000,
      "minmaxsum_minmax_budget_fraction": 0.5,
      "minmaxsum_minsum_budget_fraction": 0.5,
      "minsum_refinement_policy": "CERTIFIED_BOUND",
      "objective": "minsum",
      "per_static_time_limit_sec": 0.5,
      "profile": "DEBUG",
      "repeat": 0,
      "seed": 3743053291,
      "verify_after": true,
      "verify_each_iteration": true
    },
    "coverage_nnz": null,
    "cpu_time_sec": 0.000186,
    "dataset_profile": "smoke20",
    "dominance_invariants_ok": false,
    "dominates_minmax": false,
    "dominates_minsum": false,
    "empirical_ratio_to_exact": null,
    "error_message": "solver returned no feasible solution",
    "exact_solver": true,
    "experiment_id": "kdc-smoke20-all-registered-final-20261012T074200",
    "experiment_label": "smoke / development validation",
    "external_timeout": false,
    "failed": true,
    "failed_native_solve_count": 0,
    "fallback_solve_count": 0,
    "fallback_used": false,
    "feasible": false,
    "gap": 0.0,
    "git_commit": "f28b4e3866a51575ea47dddb3362694d84c6de25",
    "global_time_limit_sec": 0.5,
    "handovers_enabled": true,
    "heuristic_gap": 0.0,
    "heuristic_lower_bound": 0.0,
    "initial_peak_cost": 0.0,
    "instance_id": "rd100-9407ab41999f-b9917bc5f5",
    "instance_name": "rd100",
    "integral_cost": 0.0,
    "joint": null,
    "kont_version": "not-applicable",
    "lower_bound": 0.0,
    "m": 25,
    "minmax_component_certified_gap": null,
    "minmax_component_integral": null,
    "minmax_component_peak": null,
    "minmax_source_run": "",
    "minmaxsum_minmax_optimality": "FAILED",
    "minmaxsum_minmax_status": "NOT_RUN",
    "minmaxsum_minsum_optimality": "FAILED",
    "minmaxsum_minsum_status": "NOT_RUN",
    "minsum_component_certified_gap": null,
    "minsum_component_integral": null,
    "minsum_component_peak": null,
    "minsum_refinement_policy": "CERTIFIED_BOUND",
    "minsum_source_run": "",
    "n": 37,
    "native_kont": false,
    "native_solve_count": 0,
    "num_ip_solves": 1,
    "num_iterations": 0,
    "num_static_solves": 1,
    "objective": "minsum",
    "objective_value": 0.0,
    "objective_vector": null,
    "optimality_status": "FAILED",
    "peak_consistent": false,
    "peak_cost": 0.0,
    "peak_memory_mb": 16.140625,
    "peak_time": 0.0,
    "per_static_time_limit_sec": 0.5,
    "ratio_to_incumbent": null,
    "refinement_policy": "CERTIFIED_BOUND",
    "repeat": 0,
    "requested_backend": "branch-and-bound",
    "result_json_path": "result/result.json",
    "run_id": "run_20261012T042122Z__brute-force__minsum__rd100-9407ab41999f-b9917bc5f5__r00__4ad80437a993",
    "run_key": "876e46acfbf4501429dc4c309352fa8b95c1235333d79d0008c638f0ce29ee7a",
    "schema_version": 3,
    "seed": 42,
    "selected_backend": "branch-and-bound",
    "serialization_time_sec": 0.000196458,
    "solution_json_path": null,
    "solve_time_sec": 3.084e-06,
    "solver_name": "brute-force",
    "solver_runtime_sec": 3.084e-06,
    "thread_count": 1,
    "time_limit_per_ip_sec": 0.5,
    "time_limited": false,
    "timeout": false,
    "total_wall_time_sec": 0.000212833,
    "trace_csv_path": "result/trace.csv",
    "trace_jsonl_path": "result/trace.jsonl",
    "upper_bound": null,
    "verification_kind": "none",
    "verification_time_sec": 0.0,
    "verified": false,
    "verify_after": true,
    "verify_each_iteration": true,
    "wall_time_sec": 0.000212833,
    "wrapper_wall_time_sec": 0.01484324999999842
  }
}
