{
  "error_message": null,
  "execution_status": "COMPLETED",
  "experiment_id": "minmax-correctness-20261006-run01",
  "run_id": "run_20261006T023521Z__greedy__minmax__eil51-e956423838__r00__07ec082f8801",
  "run_key": "c2d66cd4f6a2905f32096e81baa00b9fe9c89f450bc049ccbc13c72f4ffc78c3",
  "schema_version": 1,
  "solver_result": {
    "actual_backend": "greedy",
    "actual_threads": 1,
    "algorithm_category": "heuristic",
    "algorithm_name": "greedy",
    "bound_status": "CERTIFIED",
    "build_type": "Release",
    "candidate_count": 325,
    "certified_gap": null,
    "certified_lower_bound": 728.3114020322719,
    "compiler": "Apple LLVM 17.0.0 (clang-1700.6.3.2)",
    "configuration": {
      "algorithm": "greedy",
      "cache_policy": "auto",
      "global_time_limit_sec": 5.0,
      "handovers_enabled": true,
      "minsum_refinement_policy": "CERTIFIED_BOUND",
      "objective": "minmax",
      "per_static_time_limit_sec": 2.0,
      "profile": "DEBUG",
      "repeat": 0,
      "seed": 45092783,
      "verify_after": true,
      "verify_each_iteration": true
    },
    "coverage_nnz": null,
    "cpu_time_sec": 0.023241,
    "dataset_profile": "smoke10",
    "empirical_ratio_to_exact": null,
    "error_message": "",
    "exact_solver": false,
    "experiment_id": "minmax-correctness-20261006-run01",
    "experiment_label": "smoke / development validation",
    "external_timeout": false,
    "failed": false,
    "failed_native_solve_count": 0,
    "fallback_solve_count": 0,
    "fallback_used": false,
    "feasible": true,
    "gap": 3.4176470588235204,
    "git_commit": "26c953ee6e7b7d1183a7881de70ee2cc331e6426",
    "global_time_limit_sec": 5.0,
    "handovers_enabled": true,
    "heuristic_gap": 3217.4227230955003,
    "heuristic_lower_bound": 0.0,
    "initial_peak_cost": 26956.090244629722,
    "instance_id": "eil51-e956423838",
    "instance_name": "eil51",
    "integral_cost": 1921.7005593970198,
    "kont_version": "not-applicable",
    "lower_bound": 728.3114020322719,
    "m": 25,
    "minsum_refinement_policy": "HEURISTIC_ADAPTIVE",
    "n": 13,
    "native_kont": false,
    "native_solve_count": 0,
    "num_ip_solves": 7,
    "num_iterations": 6,
    "num_static_solves": 7,
    "objective": "minmax",
    "objective_value": 3217.4227230955003,
    "optimality_status": "FEASIBLE",
    "peak_consistent": true,
    "peak_cost": 3217.4227230955003,
    "peak_memory_mb": 17.53125,
    "peak_time": 1.0,
    "per_static_time_limit_sec": 2.0,
    "ratio_to_incumbent": 1.0,
    "refinement_policy": "HEURISTIC_ADAPTIVE",
    "repeat": 0,
    "requested_backend": "branch-and-bound",
    "result_json_path": "result/result.json",
    "run_id": "run_20261006T023521Z__greedy__minmax__eil51-e956423838__r00__07ec082f8801",
    "run_key": "c2d66cd4f6a2905f32096e81baa00b9fe9c89f450bc049ccbc13c72f4ffc78c3",
    "schema_version": 3,
    "seed": 42,
    "selected_backend": "greedy",
    "serialization_time_sec": 0.000486958,
    "solution_json_path": "result/solution.json",
    "solve_time_sec": 0.0053702520000000024,
    "solver_name": "greedy",
    "solver_runtime_sec": 0.0053702520000000024,
    "thread_count": 1,
    "time_limit_per_ip_sec": 2.0,
    "time_limited": false,
    "timeout": false,
    "total_wall_time_sec": 0.022678999,
    "trace_csv_path": "result/trace.csv",
    "trace_jsonl_path": "result/trace.jsonl",
    "upper_bound": 3217.4227230955003,
    "verification_kind": "certified_continuous",
    "verification_time_sec": 0.016799206999999997,
    "verified": true,
    "verify_after": true,
    "verify_each_iteration": true,
    "wall_time_sec": 0.022678999,
    "wrapper_wall_time_sec": 0.03710333399999999
  }
}
