{
  "error_message": "{\"message\": \"ip-kont is registered but the native KONT/COPT backend is unavailable\", \"reason_code\": \"BACKEND_UNAVAILABLE\", \"status\": \"SKIPPED\"}",
  "execution_status": "SKIPPED",
  "experiment_id": "kdc-smoke20-all-registered-final-20261012T074200",
  "run_id": "run_20261012T042937Z__ip-kont__minmax__stars-0000030.instance-1955c914c741-2f__r00__fa5b3c07ebff",
  "run_key": "04dc0c6291cb51fdcd7ba4cdf8e49ac57644e2294fff209f9c44be1175e301cb",
  "schema_version": 1,
  "solver_result": null
}
