{
  "error_message": null,
  "execution_status": "COMPLETED",
  "experiment_id": "kdc-smoke20-all-registered-final-20261012T074200",
  "run_id": "run_20261012T042145Z__nn__minsum__uniform-0000030-2-cbaabccb536e-ac5ba17__r00__483b601d2335",
  "run_key": "57bca4412fbb35e1461b6546f528205e62e2f4753f39c144d5d9a8cfdbc79120",
  "schema_version": 1,
  "solver_result": {
    "actual_backend": "nn",
    "actual_threads": 1,
    "algorithm_category": "heuristic",
    "algorithm_name": "nn",
    "bound_status": "CERTIFIED",
    "build_type": "Release",
    "candidate_count": 50,
    "certified_gap": null,
    "certified_lower_bound": 0.0,
    "compiler": "Apple LLVM 17.0.0 (clang-1700.6.3.2)",
    "configuration": {
      "algorithm": "nn",
      "cache_policy": "auto",
      "global_time_limit_sec": 5.0,
      "handovers_enabled": true,
      "minmaxsum_minmax_budget_fraction": 0.5,
      "minmaxsum_minsum_budget_fraction": 0.5,
      "minsum_refinement_policy": "CERTIFIED_BOUND",
      "objective": "minsum",
      "per_static_time_limit_sec": 2.0,
      "profile": "DEBUG",
      "repeat": 0,
      "seed": 1006576547,
      "verify_after": true,
      "verify_each_iteration": true
    },
    "coverage_nnz": null,
    "cpu_time_sec": 0.001006,
    "dataset_profile": "smoke20",
    "dominance_invariants_ok": false,
    "dominates_minmax": false,
    "dominates_minsum": false,
    "empirical_ratio_to_exact": null,
    "error_message": "",
    "exact_solver": false,
    "experiment_id": "kdc-smoke20-all-registered-final-20261012T074200",
    "experiment_label": "smoke / development validation",
    "external_timeout": false,
    "failed": false,
    "failed_native_solve_count": 0,
    "fallback_solve_count": 0,
    "fallback_used": false,
    "feasible": true,
    "gap": 1441.1118281903846,
    "git_commit": "f28b4e3866a51575ea47dddb3362694d84c6de25",
    "global_time_limit_sec": 5.0,
    "handovers_enabled": true,
    "heuristic_gap": 0.0,
    "heuristic_lower_bound": 0.0,
    "initial_peak_cost": 0.0,
    "instance_id": "uniform-0000030-2-cbaabccb536e-ac5ba17054",
    "instance_name": "uniform-0000030-2",
    "integral_cost": 1441.1118281903846,
    "joint": null,
    "kont_version": "not-applicable",
    "lower_bound": 0.0,
    "m": 25,
    "minmax_component_certified_gap": null,
    "minmax_component_integral": null,
    "minmax_component_peak": null,
    "minmax_source_run": "",
    "minmaxsum_minmax_optimality": "FAILED",
    "minmaxsum_minmax_status": "NOT_RUN",
    "minmaxsum_minsum_optimality": "FAILED",
    "minmaxsum_minsum_status": "NOT_RUN",
    "minsum_component_certified_gap": null,
    "minsum_component_integral": null,
    "minsum_component_peak": null,
    "minsum_refinement_policy": "CERTIFIED_BOUND",
    "minsum_source_run": "",
    "n": 2,
    "native_kont": false,
    "native_solve_count": 0,
    "num_ip_solves": 10,
    "num_iterations": 4,
    "num_static_solves": 10,
    "objective": "minsum",
    "objective_value": 1441.1118281903846,
    "objective_vector": null,
    "optimality_status": "FEASIBLE",
    "peak_consistent": false,
    "peak_cost": 2894.673470277546,
    "peak_memory_mb": 16.28125,
    "peak_time": 0.0,
    "per_static_time_limit_sec": 2.0,
    "ratio_to_incumbent": 1.0,
    "refinement_policy": "CERTIFIED_BOUND",
    "repeat": 0,
    "requested_backend": "branch-and-bound",
    "result_json_path": "result/result.json",
    "run_id": "run_20261012T042145Z__nn__minsum__uniform-0000030-2-cbaabccb536e-ac5ba17__r00__483b601d2335",
    "run_key": "57bca4412fbb35e1461b6546f528205e62e2f4753f39c144d5d9a8cfdbc79120",
    "schema_version": 3,
    "seed": 42,
    "selected_backend": "branch-and-bound",
    "serialization_time_sec": 0.00036175,
    "solution_json_path": "result/solution.json",
    "solve_time_sec": 0.00029299999999999997,
    "solver_name": "nn",
    "solver_runtime_sec": 0.00029299999999999997,
    "thread_count": 1,
    "time_limit_per_ip_sec": 2.0,
    "time_limited": false,
    "timeout": false,
    "total_wall_time_sec": 0.000836292,
    "trace_csv_path": "result/trace.csv",
    "trace_jsonl_path": "result/trace.jsonl",
    "upper_bound": 1441.1118281903846,
    "verification_kind": "certified_continuous",
    "verification_time_sec": 0.000167334,
    "verified": true,
    "verify_after": true,
    "verify_each_iteration": true,
    "wall_time_sec": 0.000836292,
    "wrapper_wall_time_sec": 0.01580100000001039
  }
}
