{
  "error_message": null,
  "execution_status": "COMPLETED",
  "experiment_id": "minmax-correctness-20261006-run03",
  "run_id": "run_20261006T024224Z__branch-and-bound__minmax__berlin52-6ce5d7089a__r00__c3dc57333500",
  "run_key": "2011f52c631874cc9856f4cb473f71395f157845b67835195f5b8b96732cce6e",
  "schema_version": 1,
  "solver_result": {
    "actual_backend": "branch-and-bound",
    "actual_threads": 1,
    "algorithm_category": "exact_reference",
    "algorithm_name": "branch-and-bound",
    "bound_status": "CERTIFIED",
    "build_type": "Release",
    "candidate_count": 325,
    "certified_gap": 0.0009659090909089864,
    "certified_lower_bound": 4693.999703138588,
    "compiler": "Apple LLVM 17.0.0 (clang-1700.6.3.2)",
    "configuration": {
      "algorithm": "branch-and-bound",
      "cache_policy": "auto",
      "global_time_limit_sec": 10.0,
      "handovers_enabled": true,
      "minsum_refinement_policy": "CERTIFIED_BOUND",
      "objective": "minmax",
      "per_static_time_limit_sec": 2.0,
      "profile": "DEBUG",
      "repeat": 0,
      "seed": 4189032685,
      "verify_after": true,
      "verify_each_iteration": true
    },
    "coverage_nnz": null,
    "cpu_time_sec": 0.031786,
    "dataset_profile": "smoke10",
    "empirical_ratio_to_exact": null,
    "error_message": "",
    "exact_solver": true,
    "experiment_id": "minmax-correctness-20261006-run03",
    "experiment_label": "smoke / development validation",
    "external_timeout": false,
    "failed": false,
    "failed_native_solve_count": 0,
    "fallback_solve_count": 0,
    "fallback_used": false,
    "feasible": true,
    "gap": 0.0009659090909089864,
    "git_commit": "26c953ee6e7b7d1183a7881de70ee2cc331e6426",
    "global_time_limit_sec": 10.0,
    "handovers_enabled": true,
    "heuristic_gap": 4698.533680124574,
    "heuristic_lower_bound": 0.0,
    "initial_peak_cost": 17390.777505433485,
    "instance_id": "berlin52-6ce5d7089a",
    "instance_name": "berlin52",
    "integral_cost": 2556.5611343925366,
    "kont_version": "not-applicable",
    "lower_bound": 4693.999703138588,
    "m": 25,
    "minsum_refinement_policy": "HEURISTIC_ADAPTIVE",
    "n": 13,
    "native_kont": false,
    "native_solve_count": 0,
    "num_ip_solves": 4,
    "num_iterations": 3,
    "num_static_solves": 4,
    "objective": "minmax",
    "objective_value": 4698.533680124574,
    "optimality_status": "FEASIBLE",
    "peak_consistent": true,
    "peak_cost": 4698.533680124574,
    "peak_memory_mb": 18.078125,
    "peak_time": 1.0,
    "per_static_time_limit_sec": 2.0,
    "ratio_to_incumbent": 1.0,
    "refinement_policy": "HEURISTIC_ADAPTIVE",
    "repeat": 0,
    "requested_backend": "branch-and-bound",
    "result_json_path": "result/result.json",
    "run_id": "run_20261006T024224Z__branch-and-bound__minmax__berlin52-6ce5d7089a__r00__c3dc57333500",
    "run_key": "2011f52c631874cc9856f4cb473f71395f157845b67835195f5b8b96732cce6e",
    "schema_version": 3,
    "seed": 42,
    "selected_backend": "branch-and-bound",
    "serialization_time_sec": 0.00044870800000000003,
    "solution_json_path": "result/solution.json",
    "solve_time_sec": 0.022611167,
    "solver_name": "branch-and-bound",
    "solver_runtime_sec": 0.022611167,
    "thread_count": 1,
    "time_limit_per_ip_sec": 2.0,
    "time_limited": false,
    "timeout": false,
    "total_wall_time_sec": 0.031650166,
    "trace_csv_path": "result/trace.csv",
    "trace_jsonl_path": "result/trace.jsonl",
    "upper_bound": 4698.533680124574,
    "verification_kind": "certified_continuous",
    "verification_time_sec": 0.008569291,
    "verified": true,
    "verify_after": true,
    "verify_each_iteration": true,
    "wall_time_sec": 0.031650166,
    "wrapper_wall_time_sec": 0.045559000000000016
  }
}
