{
  "error_message": "{\"message\": \"ip-kont is registered but the native KONT/COPT backend is unavailable\", \"reason_code\": \"BACKEND_UNAVAILABLE\", \"status\": \"SKIPPED\"}",
  "execution_status": "SKIPPED",
  "experiment_id": "kdc-smoke20-all-registered-final-20261012T074200",
  "run_id": "run_20261012T042937Z__ip-kont__minmaxsum__stars-0000030.instance-1955c914c741-2f__r00__f489cd2f39cd",
  "run_key": "c30dfe42b82b4df3b97ab38b9f69df29eb270e592b413dc84a0740ccb44cc1d1",
  "schema_version": 1,
  "solver_result": null
}
