{
  "error_message": "{\"message\": \"ip-kont is registered but the native KONT/COPT backend is unavailable\", \"reason_code\": \"BACKEND_UNAVAILABLE\", \"status\": \"SKIPPED\"}",
  "execution_status": "SKIPPED",
  "experiment_id": "kdc-smoke20-all-registered-final-20261012T074200",
  "run_id": "run_20261012T041941Z__ip-kont__minsum__att48-8efa61a1d9ab-5196644df6__r00__bef28633cba5",
  "run_key": "bf6c7477475bc2fdb6fb48df9c2ac1dd528da728515c75b1cde7405314a85473",
  "schema_version": 1,
  "solver_result": null
}
