{
  "error_message": null,
  "execution_status": "INVALID",
  "experiment_id": "kdc-smoke20-all-registered-final-20261012T074200",
  "run_id": "run_20261012T042911Z__shifting__minmax__pr76-4001f85eab1a-dc636944a6__r00__e025ab09d7cc",
  "run_key": "38bd6dfff5c0e1dd8f10dcc7566e52eee9127d0c46b9453d7934fa307fc122b5",
  "schema_version": 1,
  "solver_result": {
    "actual_backend": "shifting",
    "actual_threads": 1,
    "algorithm_category": "heuristic",
    "algorithm_name": "shifting",
    "bound_status": "NONE",
    "build_type": "Release",
    "candidate_count": null,
    "certified_gap": null,
    "certified_lower_bound": 0.0,
    "compiler": "Apple LLVM 17.0.0 (clang-1700.6.3.2)",
    "configuration": {
      "algorithm": "shifting",
      "cache_policy": "auto",
      "global_time_limit_sec": 5.0,
      "handovers_enabled": true,
      "minmaxsum_minmax_budget_fraction": 0.5,
      "minmaxsum_minsum_budget_fraction": 0.5,
      "minsum_refinement_policy": "CERTIFIED_BOUND",
      "objective": "minmax",
      "per_static_time_limit_sec": 2.0,
      "profile": "DEBUG",
      "repeat": 0,
      "seed": 3373679896,
      "verify_after": true,
      "verify_each_iteration": true
    },
    "coverage_nnz": null,
    "cpu_time_sec": 0.144451,
    "dataset_profile": "smoke20",
    "dominance_invariants_ok": false,
    "dominates_minmax": false,
    "dominates_minsum": false,
    "empirical_ratio_to_exact": null,
    "error_message": "MinMax candidate verification failed: supporting-points continuous verification failed",
    "exact_solver": false,
    "experiment_id": "kdc-smoke20-all-registered-final-20261012T074200",
    "experiment_label": "smoke / development validation",
    "external_timeout": false,
    "failed": false,
    "failed_native_solve_count": 0,
    "fallback_solve_count": 0,
    "fallback_used": false,
    "feasible": false,
    "gap": 0.0,
    "git_commit": "f28b4e3866a51575ea47dddb3362694d84c6de25",
    "global_time_limit_sec": 5.0,
    "handovers_enabled": true,
    "heuristic_gap": 0.0,
    "heuristic_lower_bound": 0.0,
    "initial_peak_cost": 0.0,
    "instance_id": "pr76-4001f85eab1a-dc636944a6",
    "instance_name": "pr76",
    "integral_cost": 0.0,
    "joint": null,
    "kont_version": "not-applicable",
    "lower_bound": 0.0,
    "m": 25,
    "minmax_component_certified_gap": null,
    "minmax_component_integral": null,
    "minmax_component_peak": null,
    "minmax_source_run": "",
    "minmaxsum_minmax_optimality": "FAILED",
    "minmaxsum_minmax_status": "NOT_RUN",
    "minmaxsum_minsum_optimality": "FAILED",
    "minmaxsum_minsum_status": "NOT_RUN",
    "minsum_component_certified_gap": null,
    "minsum_component_integral": null,
    "minsum_component_peak": null,
    "minsum_refinement_policy": "HEURISTIC_ADAPTIVE",
    "minsum_source_run": "",
    "n": 25,
    "native_kont": false,
    "native_solve_count": 0,
    "num_ip_solves": 0,
    "num_iterations": 0,
    "num_static_solves": 0,
    "objective": "minmax",
    "objective_value": 0.0,
    "objective_vector": null,
    "optimality_status": "FAILED",
    "peak_consistent": false,
    "peak_cost": 0.0,
    "peak_memory_mb": 17.21875,
    "peak_time": 0.0,
    "per_static_time_limit_sec": 2.0,
    "ratio_to_incumbent": null,
    "refinement_policy": "HEURISTIC_ADAPTIVE",
    "repeat": 0,
    "requested_backend": "branch-and-bound",
    "result_json_path": "result/result.json",
    "run_id": "run_20261012T042911Z__shifting__minmax__pr76-4001f85eab1a-dc636944a6__r00__e025ab09d7cc",
    "run_key": "38bd6dfff5c0e1dd8f10dcc7566e52eee9127d0c46b9453d7934fa307fc122b5",
    "schema_version": 3,
    "seed": 42,
    "selected_backend": "branch-and-bound",
    "serialization_time_sec": 5.7042e-05,
    "solution_json_path": null,
    "solve_time_sec": 0.0,
    "solver_name": "shifting",
    "solver_runtime_sec": 0.0,
    "thread_count": 1,
    "time_limit_per_ip_sec": 2.0,
    "time_limited": false,
    "timeout": false,
    "total_wall_time_sec": 0.09472508299999999,
    "trace_csv_path": "result/trace.csv",
    "trace_jsonl_path": "result/trace.jsonl",
    "upper_bound": null,
    "verification_kind": "none",
    "verification_time_sec": 0.0,
    "verified": false,
    "verify_after": true,
    "verify_each_iteration": true,
    "wall_time_sec": 0.09472508299999999,
    "wrapper_wall_time_sec": 0.109175209
  }
}
