{
  "error_message": null,
  "execution_status": "COMPLETED",
  "experiment_id": "algorithm-smoke-20261005-complete",
  "run_id": "run_20261005T010720Z__primal-dual__minsum__euro-night-0000030-164a859873__r00__6de0a9948be9",
  "run_key": "aae0aa90c11b6a1f6d770b493fd577d9ed717efc3f5edc3f527998ef44fff445",
  "schema_version": 1,
  "solver_result": {
    "actual_backend": "primal-dual",
    "actual_threads": 1,
    "algorithm_category": "heuristic",
    "algorithm_name": "primal-dual",
    "bound_status": "CERTIFIED",
    "build_type": "Release",
    "candidate_count": 50,
    "certified_gap": null,
    "certified_lower_bound": 0.0,
    "compiler": "Apple LLVM 17.0.0 (clang-1700.6.3.2)",
    "configuration": {
      "algorithm": "primal-dual",
      "cache_policy": "auto",
      "global_time_limit_sec": 5.0,
      "handovers_enabled": true,
      "minsum_refinement_policy": "CERTIFIED_BOUND",
      "objective": "minsum",
      "per_static_time_limit_sec": 2.0,
      "profile": "DEBUG",
      "repeat": 0,
      "seed": 380216392,
      "verify_after": true,
      "verify_each_iteration": true
    },
    "coverage_nnz": null,
    "cpu_time_sec": 0.002106,
    "dataset_profile": "smoke10",
    "empirical_ratio_to_exact": null,
    "error_message": "",
    "exact_solver": false,
    "experiment_id": "algorithm-smoke-20261005-complete",
    "experiment_label": "smoke / development validation",
    "external_timeout": false,
    "failed": false,
    "failed_native_solve_count": 0,
    "fallback_solve_count": 0,
    "fallback_used": false,
    "feasible": true,
    "gap": 23.077367704559105,
    "git_commit": "88c683f46e83540a43aaab82d355020b429b6a26",
    "global_time_limit_sec": 5.0,
    "handovers_enabled": true,
    "heuristic_lower_bound": 6.646094589537642,
    "instance_id": "euro-night-0000030-164a859873",
    "instance_name": "euro-night-0000030",
    "integral_cost": 160.02046323157865,
    "kont_version": "not-applicable",
    "lower_bound": 0.0,
    "m": 25,
    "minsum_refinement_policy": "CERTIFIED_BOUND",
    "n": 2,
    "native_kont": false,
    "native_solve_count": 0,
    "num_ip_solves": 12,
    "num_iterations": 6,
    "num_static_solves": 12,
    "objective": "minsum",
    "objective_value": 160.02046323157865,
    "optimality_status": "FEASIBLE",
    "peak_cost": 480.2582403500878,
    "peak_memory_mb": 17.265625,
    "per_static_time_limit_sec": 2.0,
    "ratio_to_incumbent": 1.0,
    "refinement_policy": "CERTIFIED_BOUND",
    "repeat": 0,
    "requested_backend": "branch-and-bound",
    "result_json_path": "result/result.json",
    "run_id": "run_20261005T010720Z__primal-dual__minsum__euro-night-0000030-164a859873__r00__6de0a9948be9",
    "run_key": "aae0aa90c11b6a1f6d770b493fd577d9ed717efc3f5edc3f527998ef44fff445",
    "schema_version": 3,
    "seed": 42,
    "selected_backend": "primal-dual",
    "serialization_time_sec": 0.000334792,
    "solution_json_path": "result/solution.json",
    "solve_time_sec": 0.000502083,
    "solver_name": "primal-dual",
    "solver_runtime_sec": 0.000502083,
    "thread_count": 1,
    "time_limit_per_ip_sec": 2.0,
    "time_limited": false,
    "timeout": false,
    "total_wall_time_sec": 0.001582083,
    "trace_csv_path": "result/trace.csv",
    "trace_jsonl_path": "result/trace.jsonl",
    "upper_bound": 160.02046323157865,
    "verification_kind": "certified_continuous",
    "verification_time_sec": 0.000730293,
    "verified": true,
    "verify_after": true,
    "verify_each_iteration": true,
    "wall_time_sec": 0.001582083,
    "wrapper_wall_time_sec": 0.015284625000000052
  }
}
