{
  "error_message": "{\"message\": \"ip-kont is registered but the native KONT/COPT backend is unavailable\", \"reason_code\": \"BACKEND_UNAVAILABLE\", \"status\": \"SKIPPED\"}",
  "execution_status": "SKIPPED",
  "experiment_id": "kdc-smoke20-all-registered-final-20261012T074200",
  "run_id": "run_20261012T042937Z__ip-kont__minmax__us-night-0000030.instance-89cc3fc4c0fb__r00__0f3a489a5858",
  "run_key": "b118489c30463a27da20e112820c7c6532a851a73d03419b8e1ca2ab857ef6a9",
  "schema_version": 1,
  "solver_result": null
}
