{
  "error_message": null,
  "execution_status": "COMPLETED",
  "experiment_id": "kdc-smoke20-all-registered-final-20261012T074200",
  "run_id": "run_20261012T042010Z__lp-rounding__minmaxsum__gr96-a23a7ba30c4c-e195dfa06d__r00__c0e5ad1a75be",
  "run_key": "99ba777f499fea158504efbfa987979eabbeca95e89dc5f2d741544e8e0b5420",
  "schema_version": 1,
  "solver_result": {
    "actual_backend": "lp-rounding",
    "actual_threads": 1,
    "algorithm_category": "heuristic",
    "algorithm_name": "lp-rounding",
    "bound_status": "NONE",
    "build_type": "Release",
    "candidate_count": 875,
    "certified_gap": null,
    "certified_lower_bound": null,
    "compiler": "Apple LLVM 17.0.0 (clang-1700.6.3.2)",
    "configuration": {
      "algorithm": "lp-rounding",
      "cache_policy": "auto",
      "global_time_limit_sec": 5.0,
      "handovers_enabled": true,
      "minmaxsum_minmax_budget_fraction": 0.5,
      "minmaxsum_minsum_budget_fraction": 0.5,
      "minsum_refinement_policy": "CERTIFIED_BOUND",
      "objective": "minmaxsum",
      "per_static_time_limit_sec": 2.0,
      "profile": "DEBUG",
      "repeat": 0,
      "seed": 1901137473,
      "verify_after": true,
      "verify_each_iteration": true
    },
    "coverage_nnz": null,
    "cpu_time_sec": 1.893301,
    "dataset_profile": "smoke20",
    "dominance_invariants_ok": true,
    "dominates_minmax": true,
    "dominates_minsum": true,
    "empirical_ratio_to_exact": null,
    "error_message": "",
    "exact_solver": false,
    "experiment_id": "kdc-smoke20-all-registered-final-20261012T074200",
    "experiment_label": "smoke / development validation",
    "external_timeout": false,
    "failed": false,
    "failed_native_solve_count": 0,
    "fallback_solve_count": 20,
    "fallback_used": false,
    "feasible": true,
    "gap": null,
    "git_commit": "f28b4e3866a51575ea47dddb3362694d84c6de25",
    "global_time_limit_sec": 5.0,
    "handovers_enabled": true,
    "heuristic_gap": null,
    "heuristic_lower_bound": null,
    "initial_peak_cost": null,
    "instance_id": "gr96-a23a7ba30c4c-e195dfa06d",
    "instance_name": "gr96",
    "integral_cost": 2864.4816965720315,
    "joint": {
      "dominance_invariants_ok": true,
      "dominates_minmax": true,
      "dominates_minsum": true,
      "joint_optimality_status": "FEASIBLE",
      "minmax_component_integral": 2958.1054764181317,
      "minmax_component_optimality": "FEASIBLE",
      "minmax_component_peak": 4037.8115902514633,
      "minmax_component_status": "COMPLETED",
      "minmax_source_run": "/Users/amirpartovi/Desktop/Codes/KineticDiskCover/results/experiments/kdc-smoke20-all-registered-final-20261012T074200/runs/run_20261012T042010Z__lp-rounding__minmaxsum__gr96-a23a7ba30c4c-e195dfa06d__r00__c0e5ad1a75be/execution/solver/runs/gr96/lp-rounding/minmaxsum/component-minmax",
      "minsum_component_integral": 2997.0820309282403,
      "minsum_component_optimality": "FEASIBLE",
      "minsum_component_peak": 4112.652828392089,
      "minsum_component_status": "COMPLETED",
      "minsum_source_run": "/Users/amirpartovi/Desktop/Codes/KineticDiskCover/results/experiments/kdc-smoke20-all-registered-final-20261012T074200/runs/run_20261012T042010Z__lp-rounding__minmaxsum__gr96-a23a7ba30c4c-e195dfa06d__r00__c0e5ad1a75be/execution/solver/runs/gr96/lp-rounding/minmaxsum/component-minsum"
    },
    "kont_version": "not-applicable",
    "lower_bound": null,
    "m": 25,
    "minmax_component_certified_gap": null,
    "minmax_component_integral": 2958.1054764181317,
    "minmax_component_peak": 4037.8115902514633,
    "minmax_source_run": "/Users/amirpartovi/Desktop/Codes/KineticDiskCover/results/experiments/kdc-smoke20-all-registered-final-20261012T074200/runs/run_20261012T042010Z__lp-rounding__minmaxsum__gr96-a23a7ba30c4c-e195dfa06d__r00__c0e5ad1a75be/execution/solver/runs/gr96/lp-rounding/minmaxsum/component-minmax",
    "minmaxsum_minmax_optimality": "FEASIBLE",
    "minmaxsum_minmax_status": "COMPLETED",
    "minmaxsum_minsum_optimality": "FEASIBLE",
    "minmaxsum_minsum_status": "COMPLETED",
    "minsum_component_certified_gap": null,
    "minsum_component_integral": 2997.0820309282403,
    "minsum_component_peak": 4112.652828392089,
    "minsum_refinement_policy": "HEURISTIC_ADAPTIVE",
    "minsum_source_run": "/Users/amirpartovi/Desktop/Codes/KineticDiskCover/results/experiments/kdc-smoke20-all-registered-final-20261012T074200/runs/run_20261012T042010Z__lp-rounding__minmaxsum__gr96-a23a7ba30c4c-e195dfa06d__r00__c0e5ad1a75be/execution/solver/runs/gr96/lp-rounding/minmaxsum/component-minsum",
    "n": 35,
    "native_kont": false,
    "native_solve_count": 0,
    "num_ip_solves": 0,
    "num_iterations": 0,
    "num_static_solves": 0,
    "objective": "minmaxsum",
    "objective_value": null,
    "objective_vector": {
      "integral_cost": 2864.4816965720315,
      "peak_cost": 4037.8115902514633
    },
    "optimality_status": "FEASIBLE",
    "peak_consistent": true,
    "peak_cost": 4037.8115902514633,
    "peak_memory_mb": 32.140625,
    "peak_time": 0.0,
    "per_static_time_limit_sec": 2.0,
    "ratio_to_incumbent": null,
    "refinement_policy": "HEURISTIC_ADAPTIVE",
    "repeat": 0,
    "requested_backend": "branch-and-bound",
    "result_json_path": "result/result.json",
    "run_id": "run_20261012T042010Z__lp-rounding__minmaxsum__gr96-a23a7ba30c4c-e195dfa06d__r00__c0e5ad1a75be",
    "run_key": "99ba777f499fea158504efbfa987979eabbeca95e89dc5f2d741544e8e0b5420",
    "schema_version": 3,
    "seed": 42,
    "selected_backend": "branch-and-bound",
    "serialization_time_sec": 0.0007149579999999999,
    "solution_json_path": "result/solution.json",
    "solve_time_sec": 2.020704,
    "solver_name": "lp-rounding",
    "solver_runtime_sec": 2.020704,
    "thread_count": 1,
    "time_limit_per_ip_sec": 2.0,
    "time_limited": false,
    "timeout": false,
    "total_wall_time_sec": 2.0214519170000003,
    "trace_csv_path": "result/trace.csv",
    "trace_jsonl_path": "result/trace.jsonl",
    "upper_bound": null,
    "verification_kind": "certified_continuous",
    "verification_time_sec": 0.011535459,
    "verified": true,
    "verify_after": true,
    "verify_each_iteration": true,
    "wall_time_sec": 2.0214519170000003,
    "wrapper_wall_time_sec": 2.036027916000002
  }
}
