{
  "error_message": null,
  "execution_status": "TIME_LIMIT",
  "experiment_id": "kdc-smoke20-all-registered-final-20261012T074200",
  "run_id": "run_20261012T041918Z__branch-and-bound__minmaxsum__C-lower-90fec4bb6118-801fe3006e__r00__6967d22dede8",
  "run_key": "1d7680d3464a0965c50d5a0cde9e7c2382fac2d60c9482848acdf1781e89b85b",
  "schema_version": 1,
  "solver_result": {
    "actual_backend": "branch-and-bound",
    "actual_threads": 1,
    "algorithm_category": "exact_reference",
    "algorithm_name": "branch-and-bound",
    "bound_status": "NONE",
    "build_type": "Release",
    "candidate_count": 850,
    "certified_gap": null,
    "certified_lower_bound": null,
    "compiler": "Apple LLVM 17.0.0 (clang-1700.6.3.2)",
    "configuration": {
      "algorithm": "branch-and-bound",
      "cache_policy": "auto",
      "global_time_limit_sec": 10.0,
      "handovers_enabled": true,
      "minmaxsum_minmax_budget_fraction": 0.5,
      "minmaxsum_minsum_budget_fraction": 0.5,
      "minsum_refinement_policy": "CERTIFIED_BOUND",
      "objective": "minmaxsum",
      "per_static_time_limit_sec": 2.0,
      "profile": "DEBUG",
      "repeat": 0,
      "seed": 3949818538,
      "verify_after": true,
      "verify_each_iteration": true
    },
    "coverage_nnz": null,
    "cpu_time_sec": 4.334016,
    "dataset_profile": "smoke20",
    "dominance_invariants_ok": false,
    "dominates_minmax": false,
    "dominates_minsum": false,
    "empirical_ratio_to_exact": null,
    "error_message": "MinMax: MinMax reported peak is inconsistent with the solution; MinSum: MinSum component did not return a verified full-horizon solution",
    "exact_solver": false,
    "experiment_id": "kdc-smoke20-all-registered-final-20261012T074200",
    "experiment_label": "smoke / development validation",
    "external_timeout": false,
    "failed": false,
    "failed_native_solve_count": 0,
    "fallback_solve_count": 0,
    "fallback_used": false,
    "feasible": false,
    "gap": null,
    "git_commit": "f28b4e3866a51575ea47dddb3362694d84c6de25",
    "global_time_limit_sec": 10.0,
    "handovers_enabled": true,
    "heuristic_gap": null,
    "heuristic_lower_bound": null,
    "initial_peak_cost": null,
    "instance_id": "C-lower-90fec4bb6118-801fe3006e",
    "instance_name": "C-lower",
    "integral_cost": null,
    "joint": {
      "dominance_invariants_ok": false,
      "dominates_minmax": false,
      "dominates_minsum": false,
      "joint_optimality_status": "TIME_LIMIT",
      "minmax_component_integral": null,
      "minmax_component_optimality": "FAILED",
      "minmax_component_peak": null,
      "minmax_component_status": "FAILED",
      "minmax_source_run": "/Users/amirpartovi/Desktop/Codes/KineticDiskCover/results/experiments/kdc-smoke20-all-registered-final-20261012T074200/runs/run_20261012T041918Z__branch-and-bound__minmaxsum__C-lower-90fec4bb6118-801fe3006e__r00__6967d22dede8/execution/solver/runs/C-lower/branch-and-bound/minmaxsum/component-minmax",
      "minsum_component_integral": null,
      "minsum_component_optimality": "TIME_LIMIT",
      "minsum_component_peak": null,
      "minsum_component_status": "TIME_LIMIT",
      "minsum_source_run": "/Users/amirpartovi/Desktop/Codes/KineticDiskCover/results/experiments/kdc-smoke20-all-registered-final-20261012T074200/runs/run_20261012T041918Z__branch-and-bound__minmaxsum__C-lower-90fec4bb6118-801fe3006e__r00__6967d22dede8/execution/solver/runs/C-lower/branch-and-bound/minmaxsum/component-minsum"
    },
    "kont_version": "not-applicable",
    "lower_bound": null,
    "m": 25,
    "minmax_component_certified_gap": null,
    "minmax_component_integral": null,
    "minmax_component_peak": null,
    "minmax_source_run": "/Users/amirpartovi/Desktop/Codes/KineticDiskCover/results/experiments/kdc-smoke20-all-registered-final-20261012T074200/runs/run_20261012T041918Z__branch-and-bound__minmaxsum__C-lower-90fec4bb6118-801fe3006e__r00__6967d22dede8/execution/solver/runs/C-lower/branch-and-bound/minmaxsum/component-minmax",
    "minmaxsum_minmax_optimality": "FAILED",
    "minmaxsum_minmax_status": "FAILED",
    "minmaxsum_minsum_optimality": "TIME_LIMIT",
    "minmaxsum_minsum_status": "TIME_LIMIT",
    "minsum_component_certified_gap": null,
    "minsum_component_integral": null,
    "minsum_component_peak": null,
    "minsum_refinement_policy": "HEURISTIC_ADAPTIVE",
    "minsum_source_run": "/Users/amirpartovi/Desktop/Codes/KineticDiskCover/results/experiments/kdc-smoke20-all-registered-final-20261012T074200/runs/run_20261012T041918Z__branch-and-bound__minmaxsum__C-lower-90fec4bb6118-801fe3006e__r00__6967d22dede8/execution/solver/runs/C-lower/branch-and-bound/minmaxsum/component-minsum",
    "n": 34,
    "native_kont": false,
    "native_solve_count": 0,
    "num_ip_solves": 0,
    "num_iterations": 0,
    "num_static_solves": 0,
    "objective": "minmaxsum",
    "objective_value": null,
    "objective_vector": {
      "integral_cost": null,
      "peak_cost": null
    },
    "optimality_status": "TIME_LIMIT",
    "peak_consistent": false,
    "peak_cost": null,
    "peak_memory_mb": 786.59375,
    "peak_time": null,
    "per_static_time_limit_sec": 2.0,
    "ratio_to_incumbent": null,
    "refinement_policy": "HEURISTIC_ADAPTIVE",
    "repeat": 0,
    "requested_backend": "branch-and-bound",
    "result_json_path": "result/result.json",
    "run_id": "run_20261012T041918Z__branch-and-bound__minmaxsum__C-lower-90fec4bb6118-801fe3006e__r00__6967d22dede8",
    "run_key": "1d7680d3464a0965c50d5a0cde9e7c2382fac2d60c9482848acdf1781e89b85b",
    "schema_version": 3,
    "seed": 42,
    "selected_backend": "branch-and-bound",
    "serialization_time_sec": 0.000266291,
    "solution_json_path": null,
    "solve_time_sec": 4.6630425,
    "solver_name": "branch-and-bound",
    "solver_runtime_sec": 4.6630425,
    "thread_count": 1,
    "time_limit_per_ip_sec": 2.0,
    "time_limited": true,
    "timeout": true,
    "total_wall_time_sec": 4.663571041,
    "trace_csv_path": "result/trace.csv",
    "trace_jsonl_path": "result/trace.jsonl",
    "upper_bound": null,
    "verification_kind": "none",
    "verification_time_sec": 0.0,
    "verified": false,
    "verify_after": true,
    "verify_each_iteration": true,
    "wall_time_sec": 4.663571041,
    "wrapper_wall_time_sec": 4.690302667000001
  }
}
