{
  "error_message": null,
  "execution_status": "COMPLETED",
  "experiment_id": "algorithm-smoke-20261005-complete",
  "run_id": "run_20261005T010717Z__local-search__minsum__att48-5196644df6__r00__2140dc5e37ed",
  "run_key": "89384e5043d80c91c837d010dc7b331444a8a8dbe24827f876ce3217e570bbb8",
  "schema_version": 1,
  "solver_result": {
    "actual_backend": "local-search",
    "actual_threads": 1,
    "algorithm_category": "heuristic",
    "algorithm_name": "local-search",
    "bound_status": "CERTIFIED",
    "build_type": "Release",
    "candidate_count": 275,
    "certified_gap": null,
    "certified_lower_bound": 0.0,
    "compiler": "Apple LLVM 17.0.0 (clang-1700.6.3.2)",
    "configuration": {
      "algorithm": "local-search",
      "cache_policy": "auto",
      "global_time_limit_sec": 5.0,
      "handovers_enabled": true,
      "minsum_refinement_policy": "CERTIFIED_BOUND",
      "objective": "minsum",
      "per_static_time_limit_sec": 2.0,
      "profile": "DEBUG",
      "repeat": 0,
      "seed": 2295527851,
      "verify_after": true,
      "verify_each_iteration": true
    },
    "coverage_nnz": null,
    "cpu_time_sec": 0.026747,
    "dataset_profile": "smoke10",
    "empirical_ratio_to_exact": null,
    "error_message": "",
    "exact_solver": false,
    "experiment_id": "algorithm-smoke-20261005-complete",
    "experiment_label": "smoke / development validation",
    "external_timeout": false,
    "failed": false,
    "failed_native_solve_count": 0,
    "fallback_solve_count": 0,
    "fallback_used": false,
    "feasible": true,
    "gap": 2.181636305653297,
    "git_commit": "88c683f46e83540a43aaab82d355020b429b6a26",
    "global_time_limit_sec": 5.0,
    "handovers_enabled": true,
    "heuristic_lower_bound": 483.0679797162224,
    "instance_id": "att48-5196644df6",
    "instance_name": "att48",
    "integral_cost": 1536.9466223637237,
    "kont_version": "not-applicable",
    "lower_bound": 0.0,
    "m": 25,
    "minsum_refinement_policy": "CERTIFIED_BOUND",
    "n": 11,
    "native_kont": false,
    "native_solve_count": 0,
    "num_ip_solves": 12,
    "num_iterations": 6,
    "num_static_solves": 12,
    "objective": "minsum",
    "objective_value": 1536.9466223637237,
    "optimality_status": "FEASIBLE",
    "peak_cost": 2739.5551262630015,
    "peak_memory_mb": 17.625,
    "per_static_time_limit_sec": 2.0,
    "ratio_to_incumbent": 1.0,
    "refinement_policy": "CERTIFIED_BOUND",
    "repeat": 0,
    "requested_backend": "branch-and-bound",
    "result_json_path": "result/result.json",
    "run_id": "run_20261005T010717Z__local-search__minsum__att48-5196644df6__r00__2140dc5e37ed",
    "run_key": "89384e5043d80c91c837d010dc7b331444a8a8dbe24827f876ce3217e570bbb8",
    "schema_version": 3,
    "seed": 42,
    "selected_backend": "local-search",
    "serialization_time_sec": 0.00041975,
    "solution_json_path": "result/solution.json",
    "solve_time_sec": 0.011828918,
    "solver_name": "local-search",
    "solver_runtime_sec": 0.011828918,
    "thread_count": 1,
    "time_limit_per_ip_sec": 2.0,
    "time_limited": false,
    "timeout": false,
    "total_wall_time_sec": 0.026186834,
    "trace_csv_path": "result/trace.csv",
    "trace_jsonl_path": "result/trace.jsonl",
    "upper_bound": 1536.9466223637237,
    "verification_kind": "certified_continuous",
    "verification_time_sec": 0.01391329,
    "verified": true,
    "verify_after": true,
    "verify_each_iteration": true,
    "wall_time_sec": 0.026186834,
    "wrapper_wall_time_sec": 0.03947533400000003
  }
}
