{
  "error_message": null,
  "execution_status": "TIME_LIMIT",
  "experiment_id": "kdc-smoke20-all-registered-final-20261012T074200",
  "run_id": "run_20261012T042855Z__branch-and-bound__minmax__gr96-a23a7ba30c4c-e195dfa06d__r00__9f10dfe77271",
  "run_key": "4d794ed52504d3fdd92a691a15ff1c74eb3f7e72a50573f1635456cf13c77d7e",
  "schema_version": 1,
  "solver_result": {
    "actual_backend": "branch-and-bound",
    "actual_threads": 1,
    "algorithm_category": "exact_reference",
    "algorithm_name": "branch-and-bound",
    "bound_status": "CERTIFIED",
    "build_type": "Release",
    "candidate_count": 875,
    "certified_gap": 1.8570846951276654,
    "certified_lower_bound": 3510.044439355425,
    "compiler": "Apple LLVM 17.0.0 (clang-1700.6.3.2)",
    "configuration": {
      "algorithm": "branch-and-bound",
      "cache_policy": "auto",
      "global_time_limit_sec": 10.0,
      "handovers_enabled": true,
      "minmaxsum_minmax_budget_fraction": 0.5,
      "minmaxsum_minsum_budget_fraction": 0.5,
      "minsum_refinement_policy": "CERTIFIED_BOUND",
      "objective": "minmax",
      "per_static_time_limit_sec": 2.0,
      "profile": "DEBUG",
      "repeat": 0,
      "seed": 2341763894,
      "verify_after": true,
      "verify_each_iteration": true
    },
    "coverage_nnz": null,
    "cpu_time_sec": 2.126951,
    "dataset_profile": "smoke20",
    "dominance_invariants_ok": false,
    "dominates_minmax": false,
    "dominates_minsum": false,
    "empirical_ratio_to_exact": null,
    "error_message": "",
    "exact_solver": true,
    "experiment_id": "kdc-smoke20-all-registered-final-20261012T074200",
    "experiment_label": "smoke / development validation",
    "external_timeout": false,
    "failed": false,
    "failed_native_solve_count": 0,
    "fallback_solve_count": 0,
    "fallback_used": false,
    "feasible": true,
    "gap": 1.8570846951276654,
    "git_commit": "f28b4e3866a51575ea47dddb3362694d84c6de25",
    "global_time_limit_sec": 10.0,
    "handovers_enabled": true,
    "heuristic_gap": 10028.49424690035,
    "heuristic_lower_bound": 0.0,
    "initial_peak_cost": 10028.49424690035,
    "instance_id": "gr96-a23a7ba30c4c-e195dfa06d",
    "instance_name": "gr96",
    "integral_cost": 6985.078452846589,
    "joint": null,
    "kont_version": "not-applicable",
    "lower_bound": 3510.044439355425,
    "m": 25,
    "minmax_component_certified_gap": null,
    "minmax_component_integral": null,
    "minmax_component_peak": null,
    "minmax_source_run": "",
    "minmaxsum_minmax_optimality": "FAILED",
    "minmaxsum_minmax_status": "NOT_RUN",
    "minmaxsum_minsum_optimality": "FAILED",
    "minmaxsum_minsum_status": "NOT_RUN",
    "minsum_component_certified_gap": null,
    "minsum_component_integral": null,
    "minsum_component_peak": null,
    "minsum_refinement_policy": "HEURISTIC_ADAPTIVE",
    "minsum_source_run": "",
    "n": 35,
    "native_kont": false,
    "native_solve_count": 0,
    "num_ip_solves": 1,
    "num_iterations": 0,
    "num_static_solves": 1,
    "objective": "minmax",
    "objective_value": 10028.49424690035,
    "objective_vector": null,
    "optimality_status": "TIME_LIMIT",
    "peak_consistent": true,
    "peak_cost": 10028.49424690035,
    "peak_memory_mb": 548.71875,
    "peak_time": 1.0,
    "per_static_time_limit_sec": 2.0,
    "ratio_to_incumbent": 1.0,
    "refinement_policy": "HEURISTIC_ADAPTIVE",
    "repeat": 0,
    "requested_backend": "branch-and-bound",
    "result_json_path": "result/result.json",
    "run_id": "run_20261012T042855Z__branch-and-bound__minmax__gr96-a23a7ba30c4c-e195dfa06d__r00__9f10dfe77271",
    "run_key": "4d794ed52504d3fdd92a691a15ff1c74eb3f7e72a50573f1635456cf13c77d7e",
    "schema_version": 3,
    "seed": 42,
    "selected_backend": "branch-and-bound",
    "serialization_time_sec": 0.000741833,
    "solution_json_path": "result/solution.json",
    "solve_time_sec": 2.170171833,
    "solver_name": "branch-and-bound",
    "solver_runtime_sec": 2.170171833,
    "thread_count": 1,
    "time_limit_per_ip_sec": 2.0,
    "time_limited": true,
    "timeout": true,
    "total_wall_time_sec": 2.1857066250000003,
    "trace_csv_path": "result/trace.csv",
    "trace_jsonl_path": "result/trace.jsonl",
    "upper_bound": 10028.49424690035,
    "verification_kind": "certified_continuous",
    "verification_time_sec": 0.014756208,
    "verified": true,
    "verify_after": true,
    "verify_each_iteration": true,
    "wall_time_sec": 2.1857066250000003,
    "wrapper_wall_time_sec": 2.208680458999993
  }
}
